{
  "schemaVersion": 1,
  "planId": "deal-task-001-plan",
  "planVersion": 1,
  "taskId": "deal-task-001",
  "enterpriseId": "acme-demo",
  "businessProjectId": "20260729-001-deal-conversion",
  "projectContextVersion": 1,
  "ownerOrganizationId": "ai-deal-officer",
  "goal": "分析客户成交阻力并形成可靠客户洞察",
  "scope": [
    "customer-insight"
  ],
  "nonGoals": [
    "traffic_acquisition",
    "product_redesign",
    "brand_repositioning",
    "external_customer_contact"
  ],
  "knowledgeStatus": "degraded",
  "evidenceSummary": {
    "knownFacts": [
      {
        "classification": "customer_statement",
        "evidenceRef": "evidence/customer-1.json",
        "summary": "客户主动询问交付周期"
      }
    ],
    "hypotheses": [],
    "unknowns": [
      {
        "classification": "unknown",
        "evidenceRef": "",
        "summary": "预算审批人未知"
      }
    ],
    "evidenceRefs": [
      "evidence/customer-1.json"
    ]
  },
  "rootCauseHypothesis": {
    "code": "customer_insight",
    "ownerOrganizationId": "ai-deal-officer",
    "collaborationRequired": false
  },
  "collaborationRequests": [],
  "steps": [
    {
      "stepId": "step-1-customer-insight",
      "skillId": "customer-insight",
      "dependsOn": [],
      "inputArtifactRefs": [],
      "outputArtifactId": "customer-insight",
      "requiredScopes": [
        "deal.customer.read",
        "deal.candidate.write"
      ],
      "completionCriteria": [
        "identity_bound",
        "evidence_classified",
        "customer_profile_complete",
        "buying_motivation_evidenced",
        "deal_stage_evidenced",
        "core_concern_evidenced"
      ],
      "debugCheckpoints": [
        "before_execution",
        "during_execution",
        "after_execution"
      ],
      "status": "pending"
    }
  ],
  "retryLimitPerRootCause": 3,
  "externalActionsAllowed": false,
  "decisionBoundaries": [
    "payment",
    "external_publish",
    "irreversible_change",
    "account_permission"
  ],
  "stopConditions": [
    "same_root_cause_failed_three_times",
    "cancelled",
    "identity_mismatch",
    "compliance_blocked"
  ],
  "resumeFrom": {
    "stepId": "step-1-customer-insight",
    "checkpoint": "before_execution"
  },
  "createdAt": "2026-07-29T00:00:00.000Z"
}
